{
  "schema_version": "2.0.0",
  "checkout_intent_id": "018f1e2d-3c4b-7a20-8c9d-001122334470",
  "tenant_id": "018f1e2d-3c4b-7a01-8c9d-001122334455",
  "actor_id": "018f1e2d-3c4b-7a03-8c9d-001122334457",
  "plan_id": "crescimento",
  "state": "bound",
  "stripe_idempotency_key": "billing:checkout:018f1e2d3c4b7a208c9d001122334470",
  "catalog_fingerprint": "8fa0e11c4a89e3b4c5f2647652b19ee674c1d4af0f4aa80c53a7e40c54ec9a09",
  "provider_request_fingerprint": "3345e11c4a89e3b4c5f2647652b19ee674c1d4af0f4aa80c53a7e40c54ec0000",
  "stripe_livemode": false,
  "base_price_id": "price_testCrescimentoBase",
  "overage_price_id": "price_testCrescimentoOverage",
  "base_unit_amount_cents": 149700,
  "overage_unit_amount_cents": 3000,
  "meter_event_name": "axtro_conversation_overage",
  "existing_stripe_customer_id": "cus_AxtroExisting1",
  "success_url": "https://closer.axtroai.com/configuracoes?billing_success=1",
  "cancel_url": "https://closer.axtroai.com/configuracoes?billing_error=cancelado",
  "checkout_expires_at": "2026-08-13T21:30:00Z",
  "stripe_checkout_session_id": "cs_test_AxtroCheckout1",
  "stripe_customer_id": null,
  "stripe_subscription_id": null,
  "provider_dispatched_at": "2026-08-13T21:00:01Z",
  "session_created_at": "2026-08-13T21:00:02Z",
  "checkout_completed_at": null,
  "subscription_bound_at": null,
  "expired_at": null,
  "released_at": null,
  "created_at": "2026-08-13T21:00:00Z",
  "updated_at": "2026-08-13T21:00:02Z"
}
